<!DOCTYPE flight_plan SYSTEM "../flight_plan.dtd">

<flight_plan alt="2150" ground_alt="2080" lat0="18.9426688" lon0="-98.1893464" max_dist_from_home="1500" name="Basic" security_height="2130">
  <header>
#include "modules/datalink/datalink.h"

// Extras for Photoscan
#ifdef DC_AUTOSHOOT_PERIOD
//TODO make shooting distance not periodic
#define LINE_START_FUNCTION dc_autoshoot = DC_AUTOSHOOT_PERIODIC;
#define LINE_STOP_FUNCTION dc_autoshoot = DC_AUTOSHOOT_STOP;
#endif

</header>
  <waypoints>
    <waypoint name="HOME" x="0" y="0"/>
    <waypoint name="STDBY" x="49.5" y="100.1"/>
    <waypoint name="1" x="-27.0" y="129.3"/>
    <waypoint name="2" x="-23.9" y="301.8"/>
    <waypoint name="MOB" x="137.0" y="-11.6"/>
    <waypoint name="S1" x="-119.2" y="69.6"/>
    <waypoint name="S2" x="274.4" y="209.5"/>
    <waypoint alt="2130.0" name="AF" x="-9.4" y="40.3"/>
    <waypoint alt="2080.0" name="TD" x="-6.8" y="208.3"/>
    <waypoint name="_BASELEG" x="168.8" y="-13.8"/>
    <waypoint name="CLIMB" x="-3.3" y="129.1"/>
  </waypoints>
  <exceptions/>
  <blocks>
    <block name="Wait GPS">
      <set value="1" var="autopilot.kill_throttle"/>
      <while cond="!GpsFixValid()"/>
    </block>
    <block name="Geo init">
      <while cond="LessThan(NavBlockTime(), 10)"/>
      <call_once fun="NavSetGroundReferenceHere()"/>
    </block>
    <block name="Holding point">
      <set value="1" var="autopilot.kill_throttle"/>
      <attitude roll="0" throttle="0" vmode="throttle"/>
    </block>
    <block group="home" key="t" name="Takeoff" strip_button="Takeoff (wp CLIMB)" strip_icon="takeoff.png">
      <exception cond="GetPosAlt() @GT GetAltRef()+25" deroute="Standby"/>
      <set value="0" var="autopilot.kill_throttle"/>
      <set value="0" var="autopilot.flight_time"/>
      <go from="HOME" pitch="15" throttle="1.0" vmode="throttle" wp="CLIMB"/>
    </block>
    <block group="home" key="Ctrl+a" name="Standby" strip_button="Standby" strip_icon="home.png">
      <circle radius="nav_radius" wp="STDBY"/>
    </block>
    <block group="base_pattern" key="F8" name="Figure 8 around wp 1" strip_button="Figure 8 (wp 1-2)" strip_icon="eight.png">
      <eight center="1" radius="nav_radius" turn_around="2"/>
    </block>
    <block group="base_pattern" name="Oval 1-2" strip_button="Oval (wp 1-2)" strip_icon="oval.png">
      <oval p1="1" p2="2" radius="nav_radius"/>
    </block>
    <block group="base_pattern" name="MOB" strip_button="Circle around here" strip_icon="mob.png">
      <call_once fun="NavSetWaypointHere(WP_MOB)"/>
      <set value="DEFAULT_CIRCLE_RADIUS" var="nav_radius"/>
      <circle radius="nav_radius" wp="MOB"/>
    </block>
    <block group="extra_pattern" name="Survey S1-S2" strip_button="Survey (wp S1-S2)" strip_icon="survey.png">
      <survey_rectangle grid="80" wp1="S1" wp2="S2"/>
    </block>
    <block group="extra_pattern" name="Path 1,2,S1,S2,STDBY" strip_button="Path (1,2,S1,S2,STDBY)" strip_icon="path.png">
      <path wpts="1,2 S1"/>
      <path approaching_time="1" pitch="auto" throttle="0.4" wpts="S1, S2 STDBY"/>
      <deroute block="Standby"/>
    </block>
    <block group="land" name="Land Right AF-TD" strip_button="Land right (wp AF-TD)" strip_icon="land-right.png">
      <set value="DEFAULT_CIRCLE_RADIUS" var="nav_radius"/>
      <deroute block="land"/>
    </block>
    <block group="land" name="Land Left AF-TD" strip_button="Land left (wp AF-TD)" strip_icon="land-left.png">
      <set value="-DEFAULT_CIRCLE_RADIUS" var="nav_radius"/>
      <deroute block="land"/>
    </block>
    <block name="land">
      <call_once fun="nav_compute_baseleg(WP_AF, WP_TD, WP__BASELEG, nav_radius)"/>
      <circle radius="nav_radius" until="NavCircleCount() @GT 0.5" wp="_BASELEG"/>
      <circle radius="nav_radius" until="NavQdrCloseTo(DegOfRad(baseleg_out_qdr)-(nav_radius/fabs(nav_radius))*10) @AND (fabs(GetPosAlt() - WaypointAlt(WP__BASELEG)) @LT 10)" wp="_BASELEG"/>
    </block>
    <block name="final">
      <exception cond="GetAltRef() + 10 @GT GetPosAlt()" deroute="flare"/>
      <go from="AF" hmode="route" vmode="glide" wp="TD"/>
    </block>
    <block name="flare">
      <go approaching_time="0" from="AF" hmode="route" throttle="0.0" vmode="throttle" wp="TD"/>
      <attitude roll="0.0" throttle="0.0" until="FALSE" vmode="throttle"/>
    </block>
  </blocks>
</flight_plan>
